{
  "schema_version": "asd_result.v1",
  "project_id": "project-123",
  "model_version": "asd-heuristic-1.0.0",
  "segments": [
    {
      "start_ms": 0,
      "end_ms": 12500,
      "speaker_cluster_id": "spk_0",
      "active_face_track_id": "track_04",
      "person_id": "person_001",
      "lip_sync_confidence": 0.91,
      "visible_ratio": 0.96,
      "evidence": { "mouth_open_ratio": 0.42, "audio_energy_align": 0.9 }
    },
    {
      "start_ms": 45000,
      "end_ms": 62000,
      "speaker_cluster_id": "spk_0",
      "active_face_track_id": null,
      "person_id": null,
      "lip_sync_confidence": 0.1,
      "visible_ratio": 0.0,
      "evidence": { "note": "無臉可見（畫面切到商品）" }
    },
    {
      "start_ms": 100000,
      "end_ms": 108000,
      "speaker_cluster_id": "spk_1",
      "active_face_track_id": "track_09",
      "person_id": null,
      "lip_sync_confidence": 0.55,
      "visible_ratio": 0.7,
      "evidence": { "mouth_open_ratio": 0.28, "audio_energy_align": 0.6 }
    }
  ],
  "created_at": "2026-07-14T10:05:20Z"
}
